,product_id,product_name,category_id,no_orders
12,66513,Cattle Combo (Special Offer),6501,0
11,62005,Crude Soya Oil,5134,0
10,20227,Methionine (Feed Grade) - 25Kg,2703,0
9,63520,Neomycin Sulphate 5% WSP (100g Sachets),2703,0
8,62810,Poultry Scalding Machine (Imported),880,0
7,61462,Broiler Concentrate 40% (Animal Care Brand),2701,0
6,61434,Rolax (Systemic/ Contact Fungicide | 50g),5134,0
5,61422,Ultimax Plus (Systemic Fungicide | 50g Sachets),5134,0
4,61279,Cold Room (NPI Cool | 3HP | 5HP | 7.5HP),880,0
3,61274,Blast Freezer (NPI Cool | 15HP | 20HP | 30HP),880,0
2,61259,Blast Freezer (NPI Cool | 5HP | 7.5HP | 10HP),880,0
1,61255,Ring Die Feed Pelletizing Mill (100-400kg/hr),880,0
0,61204,H-Type Battery Cage for Rabbits (3 Tier | Fully Galvanized),2814,0
